listing,price,brand,size
Hermes tote bag,2500.0,Hermes,OS
Union Jack clutch makeup bag,12.0,Union Jack,OS
Bally Black Leather Woven Wallet,315.0,Bally,OS
Vera Bradley Quilted Crossbody Purse,15.0,Vera Bradley,W9”xH5”xD3”
Coach Turnlock Leather Hobo Bag Black In Cream,250.0,Coach,OS
"Certificate of Authenticity (24 hour)(COA)
          
      NWT",29.0,,OS
Tan Boho Inspired Velvety Crossbody Bag with Beautiful Lining,22.0,Source Unknown,OS
Vera Bradley STAINED GLASS MEDALLION Large Market Tote Bag Reusable NWOT,22.0,Vera Bradley,19” w x 16” h x 6.5” d approx
612. Stunning Michael Kors Navy Blue Wallet. NWOT.‎,45.0,Michael Kors,OS
Kate Spade Purse,48.0,kate spade,OS
MCM Viesto Berlin 3 Fold Silver Leather Monogram Unisex Wallet,180.0,MCM,OS
Fossil Black Leather Wristlet Wallet,25.0,Fossil,OS
Vintage 70’s SHARIF detailed crossbody purse,40.0,Sharif,OS
"NEW Disney Minnie Mouse Pink Satin Make up Bag
          
      NWT",31.0,Disney,OS
Vera Bradley Large Tote Pop Art Geometric Colorful Pockets Great Condition,25.0,Vera Bradley,OS
Coach Black Patent Leather Wristlet,20.0,Coach,OS
Vintage Tori Totes of Georgia lighthouse handbag with wooden clasp navy red,50.0,Vintage,OS
"NEW • SANDRO Leather shoulder bag
          
      NWT",225.0,Sandro,OS
BRIGHTON Women’s  Checkbook Wallet (7x4 Closed Leather Crocodile Leather,30.0,Brighton,7”x 4”
NWOT Furla Julia Pink Studded Bag,175.0,Furla,9” x 6 1/2” x 3”
MICHAEL KORS Zip Around Long Wallet Signature logo,50.0,Michael Kors,OS
Vera Bradley Pink and Orange Floral Shoulder Bag NWOT,25.0,Vera Bradley,OS
"MICHAEL KORS Large Pebbled Leather Card
Holder Case Electric Pink
          
      NWT",48.0,Michael Kors,"3.75™W X 2.75""H X 0.75""D"
"Coach Legacy Hampton Bag Crossbody
 ***pristine condition***",75.0,Coach,OS
Vera Bradley shoulder bag + wallet,50.0,Vera Bradley,OS
Louis Vuitton Porte Monnaie Monogram Pochette Credit Long Wallet,56.0,Louis Vuitton,OS
Mugler Paris Cosmetic Case,15.0,Mugler,See description
Korto Momolu orange embossed vegan leather purse,44.0,Korto Momolu,OS
Poshmark Discount Code,10.0,discount code,OS
Louis Vuitton St-Jacques Shopping GM,960.0,Louis Vuitton,GM
"Bijoux Terner Orange Handbag Purse with Silver Chain Strap, Pearls, Bow Design",24.0,Bijoux Terner,OS
"Vera Bradley Original Tote w/ Large Envelope Tech Sleeve Ultramarine Blue NWT
          
      NWT",68.0,Vera Bradley,OS
LSU Tigers Clear Crossbody Bag and Coin Purse,26.0,,OS
💎✨HOT BUY✨💎AUTHENTIC Gucci Guccissima Leather Shoulder bag,688.0,Gucci,OS
Victoria's Secret Black Backpack with Fringe,20.0,Victoria's Secret,Tall 14” long 15” deep 61/2”
"Michael Kors MD MF Phone Xbody Bag Vanilla
          
      NWT",124.0,Michael Kors,OS
"7 for all Mankind small shopper bag
          
      NWT",15.0,7 For All Mankind,OS
Black Formal Clutch * Prom * Ballet * Homecoming * Cocktail Party * Formal Event,18.0,,OS
Coach Pebbled Leather Trifold Wallet F53708 in Black GUC,55.0,Coach,OS
"Bebe Fabiola Stamped Creme Crocodile Crossbody Bag. Brand New!!!!
          
      NWT",69.0,bebe,OS
Black Coach Bag,100.0,,OS
Fossil Leather Crossbody‎ Brown Handbag Gold Tone Hardware 10” X 10” Adjustable,36.0,Fossil,10” x 10”
"Latico NJ USA Black Leather Bag, 2 large, multiple small compartments, 16x13x3",80.0,latico,16 x 13 x 3 inches
Ipsy Red Flower Mask Image Makeup Cosmetic Bag,7.0,ipsy,Small
Hawaii‎ Collection Hula Girl Small Zipper Pouch With Key Ring Travel.,12.0,,OS
"NEW Ipsy Bag Yellow Checker Houndstooth Print Cosmetic Make up bag
          
      Boutique",13.0,ipsy,OS
a new day Beige Croc-Embossed‎ Crossbody Bag,12.0,a new day,OS
"Trina Turk cosmetics makeup travel case light blue NWT
          
      NWT",25.0,Trina Turk,OS
Recycled Rubber Crossbody Shoulder Bag Hand Woven From Nepal Sustainable,15.0,other,OS
Be The Leslie Knope of Whatever You Do Make Up Bag,20.0,,OS
Lily Bloom Floral Zip Pockets Backpack,24.0,Lily Bloom,14x 12x 3.5
Vintage Black Crescent Shoulder Bag Purse Women's,15.0,Old Navy,OS
"BEST BRANDS BRAND NEW WITH TAGS SUPER CUTE COSMETIC BAG
          
      NWT",25.0,Best Brands,OS
"New! Boho Embroidered Jacquard Backpack
          
      Boutique",70.0,Hart And Fox Boutique,OS
‘AUTHENTICATED’Louis Vuitton Brown and Tan Monogram Tote,650.0,Louis Vuitton,OS
Mossimo Supply Co Mini Crossbody Bag Brown Vegan Leather Casual Steampunk Retro,17.0,Mossimo Supply Co.,"6""H x 4.5""W x 3""D"
Frye Melissa Trifold Antique Leather Wallet Sandstone Brick Red,90.0,Frye,OS
LOUIS VUITTON new lv bag,427.0,Louis Vuitton,OS
GUCCI Micro GG Supreme Shoulder Bag PVC Brown,708.0,Gucci,W9.4 x H6.7 x D2.0inch(Approx)
Louis Vuitton Porte-Monnaie Tresor Fold Brown Monogram Leather Wallet,315.0,Louis Vuitton,5.5”L x 3.5”H
Blue Samantha Thavasa Limited Princess Jasmine Long Wallet,70.0,Samantha Thavasa,OS
Miu Miu Large Satchel,915.0,Miu Miu,OS
Kate Spade Bunches of Love Tote Bag,155.0,kate spade,OS
Zuri Patchwork Tote Bag – New,45.0,Zuri,OS
Coach | Peyton Carryall Patent Leather Coral color shoulder bag tote Travel,43.0,Coach,OS
Jessica Simpson Crossbody Wallet Brown,18.0,Jessica Simpson,OS
Vintage Beaded Evening Mini Square Crossbody Bag,25.0,Unique Vintage,OS
"Calvin Klein brown cross body bag New
          
      NWT",58.0,Calvin Klein,OS
"NWT Free People Brown Say Yes Bag
          
      NWT",50.0,Free People,OS
Steve Madden Red Cross body bag Valentine's Day ❤️,10.0,Steve Madden,OS
Like New Liz Claiborne Small Animal Crossbody‎ Handbag and Stella & Dot Clutch.,15.0,,OS
Borbonese Redwall Quail Suede Large Handbag,399.0,borbonese,OS
"Vintage 19050s Beaded Straw Clutch, Made in Japan. Small. Gold Hardware",29.0,,OS
"Coach Mini Skinny ID Case Small Wallet 
With Pop Floral Print
          
      NWT",55.0,Coach,"4 1/4"" (L) × 3"" (H) × 1/2"" (W)"
Juicy‎ Couture Wristlet Clutch Black with Hot Pink Interior,50.0,Juicy Couture,OS
"Trina Turk Colorful Swirl Print Wallet - NWT
And Box
          
      NWT",45.0,Trina Turk,OS
"Lululemon 1L Everywhere Belt Bag Plush Fleece Bone/Silver
          
      NWT",55.0,lululemon athletica,OS
"Coach Blue and Tan Designer Shoulder Bag
          
      NWT",130.0,Coach,OS
Vintage Embroidered Cloth Elephant Clutch with Sequins,29.0,Vintage,6” x 5” x 1”
Lancome Black and White Floral Tote,19.0,Lancome,15x13
"Cozumel Sunset Pouch – Yellow & Purple Vibrant Cozumel Mexico Pouch
          
      Boutique",10.0,Passion of Essence,OS
Michael Michael Kors MK Off White Leather East West Hamilton Tote Cream Shoulder,60.0,MICHAEL Michael Kors,OS
Elegant Floral Cream Handbag with Bamboo Handle,18.0,,OS
"Nicole Miller 2-Piece Bag Set, Bone, Bag: 10×8×2.5, Pouch: 4×1, NWT
          
      NWT",40.0,Nicole Miller New York,OS
"Badgley Mischka Pleated Crossbody Bag Deep Plum Vegan‎ Leather Braid Chain Strap
          
      NWT",17.0,Badgley Mischka,OS
NWT Longchamp Le Pliage Original Large Shoulder Nylon Bag Tote,95.0,Longchamp,OS
"NWT Laurel Burch Cat Cosmetic Makeup Bag With Mirror!
          
      NWT",16.0,Laurel Burch,OS
BRAHMIN AMY IN RARE LATTE BUENA VISTA SHOULDER BAG​​​​​​​​​,195.0,Brahmin,OS
Coach Mini Belt Bag In Colorblock Signature Canvas,110.0,Coach,OS
"J World Terry Messenger‎ Bag For School And Travel, Blue Raspberry",15.0,j world,OS
Bach to the 90s Clear Tote Bag,25.0,,OS
Victoria Leather Company Light Tan Leather Saddle Bag,95.0,Victoria Leather Company,OS
"Vera Bradley Where’s Mickey? Large cosmetic toiletries travel bag
          
      NWT",59.0,Vera Bradley,OS
Dooney & Bourke‎ Large Black/NYLON Red interior Tote,73.0,Dooney & Bourke,11.5” H and 16” W.
"Coach Mini Beat Bag Bag Charm
          
      NWT",110.0,Coach,OS
MCM Blue Studded Women's Bag,290.0,MCM,OS
"PH Design Minimalist Canvas‎ Makeup Bag Cosmetic Pouch with Logo Print
          
      NWT",5.0,,OS
Coach Tan Brown Signature Op Art Satchel Bag,52.0,Coach,OS
Kate Spade Cobalt PVC Beach Club Beth Wicker Basket Tote Bag,100.0,kate spade,OS
"Rebecca Minkoff Ascher Crossbody, red with evil eyes, EUC!",179.0,Rebecca Minkoff,OS
Sakroots | crossbody bag Navy Spirit Desert 2 Artist Circle pattern navy blue,28.0,Sakroots,OS
"NWT Juicy Couture Pink Blank Canvas Sequin Triangular Frame Pouch Wristlet
          
      NWT",25.0,Juicy Couture,OS
Vintage Buxton Brown Leather Women's Wallet and Key Trainer Set,15.0,,OS
"Brahmin Large Duxbury Fairest Grey Breakwater Leather Satchel & Veronica Wallet
          
      NWT",499.0,Brahmin,OS
"Organza Silk Floral Embroidered Clutch New
          
      NWT",90.0,Boutique,OS
ALO Yoga Explorer Convertible Pack | 3L Nylon Waist Bag,55.0,ALO Yoga,OS
Ralph Lauren Polo clutch,185.0,Polo Ralph Lauren,OS
Faux Snakeskin Small Clear Crossbody Bag,25.0,,OS
Colorblock Satchel Bag,16.0,Diane Von Furstenberg,OS
Faux Leather Crossbody / Shoulder / Purse Brown with Gunmetal Hardware Gift Idea,16.0,Unknown,OS
Aeropostale Tote Bag,15.0,Aeropostale,OS
Beaded Vintage Evening Bag,95.0,Vintage,OS
GUCCI Sukey Brown Cloth Satchel 240-020425,595.0,Gucci,"13""L x 7""W x 10""H"
FENDI Nylon tote Handbag,325.0,Fendi,11.5x13.5x6.75 inches
Vintage Tapestry Brocade Tapestry Knitting Purse Amber Acrylic Handle Tote Bag,20.0,Vintage,OS
Entrupy Verified Seller‼️🔥 Purchase a Certificate of Authenticity,47.0,,OS
Satchel Savannah Stewardess Bag Copper Cowhide Burgundy Leather handmade in GA,119.0,satchel,OS
Brown Liz Claiborne Elly Convertible Crossbody Bag I’m vegan leather,15.0,Liz Claiborne,OS
Gucci Vintage GG Monogram Supreme Boston Handbag PVC Leather Navy,499.0,Gucci,OS
Saint Laurent Cassandra Leather Zip Around Wallet,320.0,Saint Laurent,OS
Anne Klein Quilted Crossbody Handbag Purse With Scarf,30.0,Anne Klein,OS
"b.o.c. Born Concept BAG Large Shoulder Handbag NWT $99
          
      NWT",39.0,b.o.c,OS
Tianni Quilted Crossbody Bag - Small Silver Chic & Versatile Women's Evening Bag,25.0,tianni,OS
Vera Bradley Navy Quilted Wristlet,30.0,Vera Bradley,OS
"Crescent Shoulder Bag for Women Black
          
      NWT",59.0,,OS
"Ed Hardy Hardside Luggage
          
      NWT",275.0,Ed Hardy,"20"" × 16"" × 10"" + 2"""
Primeware Insulate Wine Clutch magenta pink faux crocodile gift bag tote,11.0,Primeware,OS
Studio C puffy Colorful Quilted zipper cosmetic Pouch,12.0,studio C,OS
"‼️NEW IN‼️White Teddy Bear Print Diaper Backpack Fast Shipping 📦
          
      NWT",16.0,,OS
Valentino Dust Bag,15.0,Valentino,No size
"Coach satchel bag NWT black crossbody
          
      NWT",186.0,Coach,OS
Ralph Lauren RLL leather tote bag. Classic.,125.0,Ralph Lauren Double RL,OS
Textured Black Hobo Shoulder Bag w/ Silver Hardware,55.0,HOBO,OS
Kate Spade Arbor Hill Charline Black Leather Bag,105.0,kate spade,OS
Elegant Black Feathered Women's Bag,15.0,Boots,OS
Gucci Tote Large Shopping Bag Tote with PVC/TPU Cover Rare Find Limited Edition,289.0,Gucci,OS
Etienne Aigner Black Leather Shoulder Bag Classic Design,25.0,Etienne Aigner,OS
Anne Klein Metallic Wristlet,25.0,Anne Klein,OS
Fossil Leather Purse Crossbody Adjustable Strap,23.0,Fossil,OS
"MCM Yellow Small Anna Tote AUTHENTIC NWT
          
      NWT",800.0,MCM,OS
CHRISTIAN DIOR CD Logo Caro Mini Shoulder Bag Leather Black GHW Italy 653RK180,5120.0,Dior,"W  7.5 x H 4.3 x D 2   "" (approx.)"
Louboutin Pink Purse Authenticated by Real Authentication,2890.0,Christian Louboutin,PURSE: 8.25 in. X 8.50 in.
Johnny Was Women's Blue Geometric Floral Reusable Tote Bag,22.0,Johnny Was,OS
Brighton Black Pebble Leather Brown Croc Trim Shoulder Bag Purse,35.0,Brighton,OS
"The SAK Shoulder Purse Crochet Bag Blue White Woven Double Strap 10""X14"" Handbag",24.0,The Sak,OS
VINTAGE 80’s leather elephant wallet,15.0,Vintage,OS
"SOHO London New York Sm Makeup Case Pink/Purple 6.5""x3.25""x3""",15.0,SOHO London New York,"6.5""x3.25""x3"""
"Michael Kors Reed Small Satchel Crossbody Bag & Large Trifold Wallet Light Pink
          
      NWT",259.0,Michael Kors,OS
"KARL LAGERFELD Women’s Purse,Crossbody.NWT.
          
      NWT",200.0,Karl Lagerfeld,OS
Multicolored Boho Style Bag By Like International,15.0,Like International,OS
Hand Tooled Hand Painted  Leather Hand Bag Moroccan,28.0,,OS
"Black Faux Fur Crossbody Clutch
          
      Boutique",52.0,,"15""L x 8""H"
Women's bag,25.0,MICHAEL Michael Kors,OS
Kipling Sabian Mini Crossbody Bag,38.0,Kipling,OS
Latico Brown Leather Shoulder Purse Tote Bag Distressed Top Zipper Double Handle,100.0,latico,OS
Madewell Large Transport Camera Bag Camel Color Leather Two Straps,46.0,Madewell,OS
💎✨HOT BUY✨💎AUTHENTIC LV Saumur 30 Crossbody,945.0,Louis Vuitton,OS
Louis Vuitton Epi Porte Monnaie Viennois Wallet in Toledo Blue,205.0,Louis Vuitton,OS
💎✨STUNNING✨💎Authentic VALENTINO RED Shoulder bag,441.0,Valentino,OS
"🍓NWT Michael Kors Voyager Set
          
      NWT",290.0,Michael Kors,OS
"Montana West Blue Leather Shoulder Bag, Nee Without Tag
          
      NWT",18.0,Montana West,OS
Brown Leather Crossbody Dome bag purse. Bee motif. Pre-owned,33.0,,OS
💕 Rachel pally reversible clutch nwot cute 💕,45.0,Rachel Pally,10 1/2 x 7 in
"Kate Spade White Wristlet with Minnie Mouse Design
          
      NWT",68.0,kate spade,OS
"Crossbody Strap, Replacement Handbag Strap, Guitar Strap, Adjustable
          
      NWT",23.0,,27”-49”
Brahmin Cami Satchel Timeless Taupe Ombre Melbourne,72.0,Brahmin,OS
"Coach Signature Blue and Tan Shoulder Bag
          
      NWT",125.0,Coach,OS
"Stylish Beige Fur Handbag with Gold Accents by Steve Madden
          
      NWT",38.0,Steve Madden,OS
Coach Beige Leather Shoulder Bag,45.0,Coach,OS
Kate Spade | Dawn Place Embroidered Madelyne shoulder bag,60.0,kate spade,OS
"🌹🤍💎 NWT Charming Charlie Satin Rose Kiss Lock Diamond Purse in Snowy White
          
      NWT",34.0,Charming Charlie,OS
LOUIS VUITTON Juliette MM Blue Monogram Mini Lin Shoulder Bag #58519,550.0,Louis Vuitton,OS
"Vera Bradley Where’s Mickey? Purse and wristlet wallet bundle
          
      NWT",150.0,Vera Bradley,OS
Stylish Elephant Black and Pink Vera Bradley Tote Bag,20.0,Vera Bradley,OS
"NWT Betsey Johnson BETSEYVILLE CALL ME PHONE TOTE
          
      NWT",158.0,Betsey Johnson,OS
COCCINELLE Hot Pink Women's Pebbled Soft Leather Wallet Handmade In Italy Summer,85.0,Coccinelle,OS
Louis Vuitton Epi Green Tassil Leather Elise Bifold Vintage Wallet SP0998,79.0,Louis Vuitton,OS
NWOT Madden Girl Leopard and Black Satchel,17.0,Madden Girl,OS
MCM BUCKET BAG With Lock,149.0,MCM,OS
lululemon athletica Black and Green belt bag,43.0,lululemon athletica,OS
Unbranded Embroidered Floral Ethnic‎ Travel Medium Backpack -NEW,15.0,,Medium
Fossil blue black leather organizer crossbody bag,31.0,Fossil,OS
"Dabney Lee | Cosmetic Bag Pink Watermelon Print
          
      NWT",18.0,Dabney Lee,10 x 6 x 4
Kate spade leopard slim phone case/wallet. Can be worn crossbody. Brand new,70.0,kate spade,OS
"Calpak Lavender Backpack with Zipper Detail
          
      NWT",150.0,Calpak,OS
Authentic Chanel Vintage Black Duma Leather Quilted Mini backpack with 24k,4995.0,CHANEL,OS
Vtg COACH Hampton caramel leather Y2K Demi small shoulder bag 7540,135.0,Coach,OS
Suo•nv Purse,15.0,SUO•NY,OS
Christian Siriano for Payless Tote Bag Faux Leather Black and Grey,30.0,Christian Siriano,OS
Kate Spade Lilac Patent Leather Tote,150.0,kate spade,OS
Disney parks pin and keychain display backpack blue,22.0,Disney,OS
Luv Betsy By Betsy Johnson Striped Mini Crossbody Purse Bag white black pink,17.0,Luv Betsey by Betsey Johnson,OS
⭐🔥AUTHENTIC🔥⭐Louis Vuitton Drouot Crossbody,985.0,Louis Vuitton,OS
Coach Brooke Convertible Pewter Silver Metallic Shoulder Bag like new,99.0,Coach,OS
Kate Spade Vibrant Red Quilted Mini Bag,80.0,kate spade,OS
Vera Bradley Hadley Rain Forest Crossbody Quilted Bag,25.0,Vera Bradley,OS
Betsey Johnson Yorkie Mini Backpack Purse Yellow Black Bag,42.0,Betsey Johnson,OS
Calvin Klein Hudson Signature CK Cream&Tan Satchel Shoulder Bag,69.0,Calvin Klein,OS
Coach Women's Red Wallet-purses,50.0,Coach,OS
"NWT Trina Turk - Wine/Tan; Double Handle/Cross Body Purse with Card Holder
          
      NWT",42.0,Trina Turk,OS
Vintage Woven Straw Raffia Purse Clutch Embroidered Flowers Handbag Boho,40.0,,OS
"🆕 Straw Beach Bag,Women Hobo Summer Woven Large Handbags Straw Tote Bag",25.0,,OS
"Michael Kors Charlotte Large Leather Top-Zip Tote Bag - Vanilla/Brown
          
      NWT",169.0,Michael Kors,Large
"Michael Kors Mirella small shopper crossbody bag canvas pink powder blush
          
      NWT",348.0,Michael Kors,OS
ALO Yoga Crossbody Bag with Ornate Design,43.0,ALO Yoga,OS
❤️New GUCCI  Bag❤️,460.0,,OS
Baggallini black crossbody,18.0,Baggallini,OS
Sacred Heart Lancel,60.0,lancel,OS
Vintage beaded evening back clutch,36.0,,OS
GUCCI  GG Crystal Monogram Fringe Babouska Hobo Shoulder Bag,799.0,Gucci,"16.7 x 14.7 x 2.4"" strap drop 10"" approx"
"Cat Crossbody bag
          
      NWT",40.0,Source Unknown,OS
"Chic Red Tote Womens with Adjustable Strap Zip Closure & Tassel Shoulder Bag
          
      Boutique",48.0,,OS
Kelly & Katie Rose Gold Pink Clutch Wristlet Chain Shoulder Bag Crossbody Purse,9.0,Kelly & Katie,OS
"NWT Michael Kors Shoulder Bag Set
          
      NWT",228.0,Michael Kors,OS
Michael Kors Charlotte Medium 2-in-1 Saffiano Leather & Logo Tote Bag in Poppy,279.0,Michael Kors,OS
Vintage Meyers Ostrich Frame Kisslock Handbag,100.0,,OS
"Brandon Blackwood mini leopard Kendrick trunk
          
      NWT",490.0,Brandon Blackwood,Mini
"Michael Kors Sheila Medium Ombré Signature Logo Satchel Black Multi
          
      NWT",223.0,Michael Kors,Medium
Coach Porch Blue Double Zip Wallet,65.0,Coach,OS
Vintage Michael kors red pouch see pics,25.0,MICHAEL Michael Kors,OS
New Dior Bag,475.0,,OS
GiGi New York Navy Blue Crossbody adjust Handbag,45.0,GiGi New York,Medium
Vintage Gold Mesh Clutch Makeup‎ Pouch Coin Bag Duramesh Fifth Avenue Art Deco,17.0,& Other Stories,OS
Free People En Riva Raffia Tote,85.0,Free People,one size
Fossil Leather Shoulder Bag Bohemian,40.0,Fossil,OS
"🆕💚 Lululemon Everywhere Belt Bag Cactus Leather Alternative - Barack Green
          
      NWT",100.0,lululemon athletica,OS
Cream Floral Women's Backpack,25.0,madden nyc,OS
"NWT Ah•Dorned Vegan Tan Sling Bag with Patterned Strap
          
      NWT",60.0,ah dorned,8” L x 3” W x 10” H
PINK Victoria’s Secret Pink Fanny‎ Pack Adjustable,14.0,PINK Victoria's Secret,OS
Michael Kors Black Gold Logo Pebble Leather Clutch Wristlet Zip Bag,38.0,Michael Kors,OS
Luxy Black Crochet and Leather Shoulder Bag,22.0,LUXY,OS
3D lady clutch,9.0,,OS
Vintage Dooney & Bourke Brown Pebbled Leather Satchel Crossbody - 9.5”x8”x3.5”,65.0,Dooney & Bourke,OS
"KATE SPADE RIVERSIDE STREET EMMIE CROSSBODY BAG
          
      NWT",210.0,kate spade,OS
Fendi 2 way bag,399.0,Fendi,Widths 261/2 x Length 21x Depth 10 Centimeters
"Jonathan Adler Cotton Pouch Bag
          
      NWT",25.0,Jonathan Adler,OS
"NWT IN PKG WILDFOX Parachute Nylon Backpack w/Change Purse Light Blue
          
      NWT",67.0,Wildfox,OS
Burberry nova check shoulder bag,599.0,Burberry,OS
BALLY Shoulder Bag Leather Black Gold Auth 123425,662.0,Bally,Size(Inch)	W13.8 x H11.0 x D3.9inch
Kate Spade Black Leather Wristlet,32.0,kate spade,OS
